[
  {
    "id": "domovoy-control",
    "name": "Домовой",
    "author": "awbait",
    "description": "Виджет управления голосовым ассистентом: статус, микрофон, история команд.",
    "version": "0.9.0",
    "repo": "awbait/domovoy-control",
    "download_url": "https://github.com/awbait/domovoy-control/releases/latest/download/domovoy-control.zip",
    "homepage": "https://github.com/awbait/domovoy-control",
    "tags": [
      "smart-home",
      "assistant",
      "voice"
    ]
  },
  {
    "id": "example-counter",
    "name": "Example Counter",
    "author": "awbait",
    "description": "Template module demonstrating all platform features: REST API, WebSocket, events, migrations, i18n, widget settings",
    "version": "1.3.0",
    "repo": "awbait/focus-modules",
    "download_url": "https://github.com/awbait/focus-modules/releases/download/example-counter/v1.3.0/example-counter.zip",
    "homepage": "https://github.com/awbait/focus-modules",
    "preview_url": "https://raw.githubusercontent.com/awbait/focus-modules/main/modules/example-counter/preview.png",
    "tags": [
      "example",
      "template",
      "counter"
    ]
  },
  {
    "id": "pill-tracker",
    "name": "Pill Tracker",
    "author": "awbait",
    "description": "Track medication intake for humans and animals: patients, prescriptions, schedules, dose logging",
    "version": "1.1.1",
    "repo": "awbait/focus-modules",
    "download_url": "https://github.com/awbait/focus-modules/releases/download/pill-tracker/v1.1.1/pill-tracker.zip",
    "homepage": "https://github.com/awbait/focus-modules",
    "tags": [
      "health",
      "medication",
      "tracker"
    ]
  }
]
